,Surface Area (mm^2),Pretest,Posttest
HF25_R1,8836.00,no retainer frame or grid, 
HF25_R2,8836.00,Test w/o retainer frame or foil., 
HF25_R3,10000.00,Tests w/o retainer foil., 
HF50_R1,8836.00,without frame or grid, 
HF50_R2,8836.00,test w/o frame or grid, 
HF50_R3,8836.00,test w/o frame or grid,spike in mass loss rate caused by sample popping 
HF75_R1,8836.00,Test w/o retainer grid or frame, 
HF75_R2,8836.00,Test w/o retainer grid or frame,Sample had to be adjusted several times due to popping and settling causing pieces to fall
HF75_R3,8836.00,without retainer frame or grid, 
